{
  "response_schema_version": "oa_service_credential_response.v1",
  "rotated_credential": {
    "credential_schema_version": "oa_service_credential.v1",
    "credential_id": "cred-ae-primary",
    "principal_id": "ae-runtime",
    "secret_hint": "000001",
    "status": "ROTATING",
    "issued_at": 1790985600,
    "expires_at": 1793577600,
    "grace_until": 1790985660,
    "revision": 2
  },
  "credential": {
    "credential_schema_version": "oa_service_credential.v1",
    "credential_id": "cred-ae-secondary",
    "principal_id": "ae-runtime",
    "secret_hint": "000002",
    "status": "ACTIVE",
    "issued_at": 1790985600,
    "expires_at": 1793577600,
    "grace_until": null,
    "revision": 1
  },
  "client_secret": "fixture-only-client-secret-value-000002",
  "secret_display": "once",
  "request_id": "request-1259",
  "trace_id": "trace-1259",
  "audit_event": {
    "ok": true,
    "event_id": "event-rotation-1259",
    "service_id": "nex-oa",
    "event_type": "SERVICE_CREDENTIAL_ROTATED",
    "severity": "INFO"
  }
}
